{
  "initial_state": "intake",
  "key": "field_inspection",
  "metadata": {
    "actor": "field_inspector",
    "generated_from": "jtbd",
    "sla_breach_seconds": 172800,
    "title": "Conduct Field Inspection"
  },
  "states": [
    {
      "kind": "manual_review",
      "name": "intake",
      "swimlane": "field_inspector"
    },
    {
      "kind": "manual_review",
      "name": "review",
      "swimlane": "reviewer"
    },
    {
      "kind": "manual_review",
      "name": "escalated",
      "swimlane": "supervisor"
    },
    {
      "kind": "terminal_fail",
      "name": "rejected"
    },
    {
      "kind": "terminal_success",
      "name": "done"
    }
  ],
  "subject_kind": "field_inspection",
  "transitions": [
    {
      "effects": [
        {
          "entity": "field_inspection",
          "kind": "create_entity"
        },
        {
          "kind": "audit",
          "template": "field_inspection.submitted"
        }
      ],
      "event": "submit",
      "from_state": "intake",
      "gates": [
        {
          "kind": "permission",
          "permission": "field_inspection.submit"
        }
      ],
      "guards": [],
      "id": "field_inspection_submit",
      "priority": 0,
      "to_state": "review"
    },
    {
      "effects": [
        {
          "kind": "notify",
          "template": "field_inspection.approved"
        }
      ],
      "event": "approve",
      "from_state": "review",
      "gates": [
        {
          "kind": "permission",
          "permission": "field_inspection.approve"
        }
      ],
      "guards": [],
      "id": "field_inspection_approve",
      "priority": 0,
      "to_state": "done"
    },
    {
      "effects": [
        {
          "kind": "audit",
          "template": "field_inspection.escalated"
        }
      ],
      "event": "escalate",
      "from_state": "review",
      "gates": [
        {
          "kind": "permission",
          "permission": "field_inspection.escalate"
        }
      ],
      "guards": [],
      "id": "field_inspection_escalate",
      "priority": 10,
      "to_state": "escalated"
    },
    {
      "effects": [
        {
          "kind": "notify",
          "template": "field_inspection.approved"
        }
      ],
      "event": "approve",
      "from_state": "escalated",
      "gates": [
        {
          "kind": "permission",
          "permission": "field_inspection.approve"
        }
      ],
      "guards": [],
      "id": "field_inspection_escalated_approve",
      "priority": 0,
      "to_state": "done"
    },
    {
      "effects": [
        {
          "kind": "audit",
          "template": "field_inspection.failed_inspection_rejected"
        }
      ],
      "event": "reject",
      "from_state": "review",
      "gates": [
        {
          "kind": "permission",
          "permission": "field_inspection.reject"
        }
      ],
      "guards": [],
      "id": "field_inspection_failed_inspection_reject",
      "priority": 5,
      "to_state": "rejected"
    }
  ],
  "version": "1.0.0"
}
