{
  "initial_state": "intake",
  "key": "conduct_interview",
  "metadata": {
    "actor": "hiring_manager",
    "generated_from": "jtbd",
    "sla_breach_seconds": 432000,
    "title": "Conduct interview loop"
  },
  "states": [
    {
      "kind": "manual_review",
      "name": "intake",
      "swimlane": "hiring_manager"
    },
    {
      "kind": "manual_review",
      "name": "review",
      "swimlane": "reviewer"
    },
    {
      "kind": "manual_review",
      "name": "reschedule_or_withdraw",
      "swimlane": "reviewer"
    },
    {
      "kind": "terminal_success",
      "name": "done"
    }
  ],
  "subject_kind": "conduct_interview",
  "transitions": [
    {
      "effects": [
        {
          "entity": "conduct_interview",
          "kind": "create_entity"
        },
        {
          "kind": "audit",
          "template": "conduct_interview.submitted"
        }
      ],
      "event": "submit",
      "from_state": "intake",
      "gates": [
        {
          "kind": "permission",
          "permission": "conduct_interview.submit"
        }
      ],
      "guards": [],
      "id": "conduct_interview_submit",
      "priority": 0,
      "to_state": "review"
    },
    {
      "effects": [
        {
          "kind": "notify",
          "template": "conduct_interview.approved"
        }
      ],
      "event": "approve",
      "from_state": "review",
      "gates": [
        {
          "kind": "permission",
          "permission": "conduct_interview.approve"
        }
      ],
      "guards": [],
      "id": "conduct_interview_approve",
      "priority": 0,
      "to_state": "done"
    },
    {
      "effects": [
        {
          "kind": "audit",
          "template": "conduct_interview.no_show"
        }
      ],
      "event": "submit",
      "from_state": "intake",
      "gates": [
        {
          "kind": "permission",
          "permission": "conduct_interview.submit"
        }
      ],
      "guards": [
        {
          "expr": {
            "var": "context.no_show"
          },
          "kind": "expr"
        }
      ],
      "id": "conduct_interview_no_show",
      "priority": 5,
      "to_state": "reschedule_or_withdraw"
    }
  ],
  "version": "1.0.0"
}
