{
  "initial_state": "intake",
  "key": "complete_hire",
  "metadata": {
    "actor": "hr_partner",
    "generated_from": "jtbd",
    "sla_breach_seconds": 86400,
    "title": "Complete hire and onboard"
  },
  "states": [
    {
      "kind": "manual_review",
      "name": "intake",
      "swimlane": "hr_partner"
    },
    {
      "kind": "manual_review",
      "name": "review",
      "swimlane": "reviewer"
    },
    {
      "kind": "terminal_fail",
      "name": "rejected"
    },
    {
      "kind": "terminal_success",
      "name": "done"
    }
  ],
  "subject_kind": "complete_hire",
  "transitions": [
    {
      "effects": [
        {
          "entity": "complete_hire",
          "kind": "create_entity"
        },
        {
          "kind": "audit",
          "template": "complete_hire.submitted"
        }
      ],
      "event": "submit",
      "from_state": "intake",
      "gates": [
        {
          "kind": "permission",
          "permission": "complete_hire.submit"
        }
      ],
      "guards": [],
      "id": "complete_hire_submit",
      "priority": 0,
      "to_state": "review"
    },
    {
      "effects": [
        {
          "kind": "notify",
          "template": "complete_hire.approved"
        }
      ],
      "event": "approve",
      "from_state": "review",
      "gates": [
        {
          "kind": "permission",
          "permission": "complete_hire.approve"
        }
      ],
      "guards": [],
      "id": "complete_hire_approve",
      "priority": 0,
      "to_state": "done"
    },
    {
      "effects": [
        {
          "kind": "audit",
          "template": "complete_hire.candidate_withdrawal_rejected"
        }
      ],
      "event": "reject",
      "from_state": "review",
      "gates": [
        {
          "kind": "permission",
          "permission": "complete_hire.reject"
        }
      ],
      "guards": [],
      "id": "complete_hire_candidate_withdrawal_reject",
      "priority": 5,
      "to_state": "rejected"
    }
  ],
  "version": "1.0.0"
}
