{
  "initial_state": "intake",
  "key": "permit_intake",
  "metadata": {
    "actor": "applicant",
    "generated_from": "jtbd",
    "sla_breach_seconds": 86400,
    "title": "Submit a Building Permit Application"
  },
  "states": [
    {
      "kind": "manual_review",
      "name": "intake",
      "swimlane": "applicant"
    },
    {
      "kind": "manual_review",
      "name": "review",
      "swimlane": "reviewer"
    },
    {
      "kind": "terminal_success",
      "name": "done"
    }
  ],
  "subject_kind": "permit_intake",
  "transitions": [
    {
      "effects": [
        {
          "entity": "permit_intake",
          "kind": "create_entity"
        },
        {
          "kind": "audit",
          "template": "permit_intake.submitted"
        }
      ],
      "event": "submit",
      "from_state": "intake",
      "gates": [
        {
          "kind": "permission",
          "permission": "permit_intake.submit"
        }
      ],
      "guards": [],
      "id": "permit_intake_submit",
      "priority": 0,
      "to_state": "review"
    },
    {
      "effects": [
        {
          "kind": "notify",
          "template": "permit_intake.approved"
        }
      ],
      "event": "approve",
      "from_state": "review",
      "gates": [
        {
          "kind": "permission",
          "permission": "permit_intake.approve"
        }
      ],
      "guards": [],
      "id": "permit_intake_approve",
      "priority": 0,
      "to_state": "done"
    }
  ],
  "version": "1.0.0"
}
