{
  "initial_state": "intake",
  "key": "source_candidate",
  "metadata": {
    "actor": "recruiter",
    "generated_from": "jtbd",
    "sla_breach_seconds": 86400,
    "title": "Source a candidate"
  },
  "states": [
    {
      "kind": "manual_review",
      "name": "intake",
      "swimlane": "recruiter"
    },
    {
      "kind": "manual_review",
      "name": "review",
      "swimlane": "reviewer"
    },
    {
      "kind": "terminal_fail",
      "name": "rejected"
    },
    {
      "kind": "terminal_success",
      "name": "done"
    }
  ],
  "subject_kind": "source_candidate",
  "transitions": [
    {
      "effects": [
        {
          "entity": "source_candidate",
          "kind": "create_entity"
        },
        {
          "kind": "audit",
          "template": "source_candidate.submitted"
        }
      ],
      "event": "submit",
      "from_state": "intake",
      "gates": [
        {
          "kind": "permission",
          "permission": "source_candidate.submit"
        }
      ],
      "guards": [],
      "id": "source_candidate_submit",
      "priority": 0,
      "to_state": "review"
    },
    {
      "effects": [
        {
          "kind": "notify",
          "template": "source_candidate.approved"
        }
      ],
      "event": "approve",
      "from_state": "review",
      "gates": [
        {
          "kind": "permission",
          "permission": "source_candidate.approve"
        }
      ],
      "guards": [],
      "id": "source_candidate_approve",
      "priority": 0,
      "to_state": "done"
    },
    {
      "effects": [
        {
          "kind": "audit",
          "template": "source_candidate.duplicate_candidate_rejected"
        }
      ],
      "event": "reject",
      "from_state": "review",
      "gates": [
        {
          "kind": "permission",
          "permission": "source_candidate.reject"
        }
      ],
      "guards": [],
      "id": "source_candidate_duplicate_candidate_reject",
      "priority": 5,
      "to_state": "rejected"
    }
  ],
  "version": "1.0.0"
}
