{
  "initial_state": "intake",
  "key": "permit_decision",
  "metadata": {
    "actor": "chief_building_official",
    "generated_from": "jtbd",
    "sla_breach_seconds": 432000,
    "title": "Approve or Deny Building Permit"
  },
  "states": [
    {
      "kind": "manual_review",
      "name": "intake",
      "swimlane": "chief_building_official"
    },
    {
      "kind": "manual_review",
      "name": "review",
      "swimlane": "reviewer"
    },
    {
      "kind": "terminal_fail",
      "name": "rejected"
    },
    {
      "kind": "terminal_success",
      "name": "done"
    }
  ],
  "subject_kind": "permit_decision",
  "transitions": [
    {
      "effects": [
        {
          "entity": "permit_decision",
          "kind": "create_entity"
        },
        {
          "kind": "audit",
          "template": "permit_decision.submitted"
        }
      ],
      "event": "submit",
      "from_state": "intake",
      "gates": [
        {
          "kind": "permission",
          "permission": "permit_decision.submit"
        }
      ],
      "guards": [],
      "id": "permit_decision_submit",
      "priority": 0,
      "to_state": "review"
    },
    {
      "effects": [
        {
          "kind": "notify",
          "template": "permit_decision.approved"
        }
      ],
      "event": "approve",
      "from_state": "review",
      "gates": [
        {
          "kind": "permission",
          "permission": "permit_decision.approve"
        }
      ],
      "guards": [],
      "id": "permit_decision_approve",
      "priority": 0,
      "to_state": "done"
    },
    {
      "effects": [
        {
          "kind": "audit",
          "template": "permit_decision.denied_rejected"
        }
      ],
      "event": "reject",
      "from_state": "review",
      "gates": [
        {
          "kind": "permission",
          "permission": "permit_decision.reject"
        }
      ],
      "guards": [],
      "id": "permit_decision_denied_reject",
      "priority": 5,
      "to_state": "rejected"
    }
  ],
  "version": "1.0.0"
}
