{
  "initial_state": "intake",
  "key": "extend_offer",
  "metadata": {
    "actor": "hr_partner",
    "generated_from": "jtbd",
    "sla_breach_seconds": 172800,
    "title": "Extend an offer"
  },
  "states": [
    {
      "kind": "manual_review",
      "name": "intake",
      "swimlane": "hr_partner"
    },
    {
      "kind": "manual_review",
      "name": "review",
      "swimlane": "reviewer"
    },
    {
      "kind": "manual_review",
      "name": "escalated",
      "swimlane": "supervisor"
    },
    {
      "kind": "manual_review",
      "name": "compensation_approval",
      "swimlane": "reviewer"
    },
    {
      "kind": "terminal_fail",
      "name": "rejected"
    },
    {
      "kind": "terminal_success",
      "name": "done"
    }
  ],
  "subject_kind": "extend_offer",
  "transitions": [
    {
      "effects": [
        {
          "entity": "extend_offer",
          "kind": "create_entity"
        },
        {
          "kind": "audit",
          "template": "extend_offer.submitted"
        }
      ],
      "event": "submit",
      "from_state": "intake",
      "gates": [
        {
          "kind": "permission",
          "permission": "extend_offer.submit"
        }
      ],
      "guards": [],
      "id": "extend_offer_submit",
      "priority": 0,
      "to_state": "review"
    },
    {
      "effects": [
        {
          "kind": "notify",
          "template": "extend_offer.approved"
        }
      ],
      "event": "approve",
      "from_state": "review",
      "gates": [
        {
          "kind": "permission",
          "permission": "extend_offer.approve"
        }
      ],
      "guards": [],
      "id": "extend_offer_approve",
      "priority": 0,
      "to_state": "done"
    },
    {
      "effects": [
        {
          "kind": "audit",
          "template": "extend_offer.escalated"
        }
      ],
      "event": "escalate",
      "from_state": "review",
      "gates": [
        {
          "kind": "permission",
          "permission": "extend_offer.escalate"
        }
      ],
      "guards": [],
      "id": "extend_offer_escalate",
      "priority": 10,
      "to_state": "escalated"
    },
    {
      "effects": [
        {
          "kind": "notify",
          "template": "extend_offer.approved"
        }
      ],
      "event": "approve",
      "from_state": "escalated",
      "gates": [
        {
          "kind": "permission",
          "permission": "extend_offer.approve"
        }
      ],
      "guards": [],
      "id": "extend_offer_escalated_approve",
      "priority": 0,
      "to_state": "done"
    },
    {
      "effects": [
        {
          "kind": "audit",
          "template": "extend_offer.counter_offer"
        }
      ],
      "event": "submit",
      "from_state": "intake",
      "gates": [
        {
          "kind": "permission",
          "permission": "extend_offer.submit"
        }
      ],
      "guards": [
        {
          "expr": {
            "var": "context.counter_offer"
          },
          "kind": "expr"
        }
      ],
      "id": "extend_offer_counter_offer",
      "priority": 5,
      "to_state": "compensation_approval"
    },
    {
      "effects": [
        {
          "kind": "audit",
          "template": "extend_offer.offer_expired_rejected"
        }
      ],
      "event": "reject",
      "from_state": "review",
      "gates": [
        {
          "kind": "permission",
          "permission": "extend_offer.reject"
        }
      ],
      "guards": [],
      "id": "extend_offer_offer_expired_reject",
      "priority": 6,
      "to_state": "rejected"
    }
  ],
  "version": "1.0.0"
}
