{
  "initial_state": "intake",
  "key": "claim_intake",
  "metadata": {
    "actor": "claimant",
    "generated_from": "jtbd",
    "sla_breach_seconds": 86400,
    "title": "File an insurance claim (FNOL)"
  },
  "states": [
    {
      "kind": "manual_review",
      "name": "intake",
      "swimlane": "claimant"
    },
    {
      "kind": "manual_review",
      "name": "review",
      "swimlane": "reviewer"
    },
    {
      "kind": "manual_review",
      "name": "escalated",
      "swimlane": "supervisor"
    },
    {
      "kind": "manual_review",
      "name": "senior_triage",
      "swimlane": "reviewer"
    },
    {
      "kind": "terminal_fail",
      "name": "rejected"
    },
    {
      "kind": "terminal_fail",
      "name": "compensated"
    },
    {
      "kind": "terminal_success",
      "name": "done"
    }
  ],
  "subject_kind": "claim_intake",
  "transitions": [
    {
      "effects": [
        {
          "entity": "claim_intake",
          "kind": "create_entity"
        },
        {
          "kind": "audit",
          "template": "claim_intake.submitted"
        }
      ],
      "event": "submit",
      "from_state": "intake",
      "gates": [
        {
          "kind": "permission",
          "permission": "claim_intake.submit"
        }
      ],
      "guards": [],
      "id": "claim_intake_submit",
      "priority": 0,
      "to_state": "review"
    },
    {
      "effects": [
        {
          "kind": "notify",
          "template": "claim_intake.approved"
        }
      ],
      "event": "approve",
      "from_state": "review",
      "gates": [
        {
          "kind": "permission",
          "permission": "claim_intake.approve"
        }
      ],
      "guards": [],
      "id": "claim_intake_approve",
      "priority": 0,
      "to_state": "done"
    },
    {
      "effects": [
        {
          "kind": "audit",
          "template": "claim_intake.escalated"
        }
      ],
      "event": "escalate",
      "from_state": "review",
      "gates": [
        {
          "kind": "permission",
          "permission": "claim_intake.escalate"
        }
      ],
      "guards": [],
      "id": "claim_intake_escalate",
      "priority": 10,
      "to_state": "escalated"
    },
    {
      "effects": [
        {
          "kind": "notify",
          "template": "claim_intake.approved"
        }
      ],
      "event": "approve",
      "from_state": "escalated",
      "gates": [
        {
          "kind": "permission",
          "permission": "claim_intake.approve"
        }
      ],
      "guards": [],
      "id": "claim_intake_escalated_approve",
      "priority": 0,
      "to_state": "done"
    },
    {
      "effects": [
        {
          "kind": "audit",
          "template": "claim_intake.large_loss"
        }
      ],
      "event": "submit",
      "from_state": "intake",
      "gates": [
        {
          "kind": "permission",
          "permission": "claim_intake.submit"
        }
      ],
      "guards": [
        {
          "expr": {
            "var": "context.large_loss"
          },
          "kind": "expr"
        }
      ],
      "id": "claim_intake_large_loss",
      "priority": 5,
      "to_state": "senior_triage"
    },
    {
      "effects": [
        {
          "kind": "audit",
          "template": "claim_intake.lapsed_rejected"
        }
      ],
      "event": "reject",
      "from_state": "review",
      "gates": [
        {
          "kind": "permission",
          "permission": "claim_intake.reject"
        }
      ],
      "guards": [],
      "id": "claim_intake_lapsed_reject",
      "priority": 6,
      "to_state": "rejected"
    },
    {
      "effects": [
        {
          "compensation_kind": "notify_cancellation",
          "kind": "compensate",
          "values": {
            "template": "claim_intake.approve.cancelled"
          }
        },
        {
          "compensation_kind": "notify_cancellation",
          "kind": "compensate",
          "values": {
            "template": "claim_intake.approve.cancelled"
          }
        },
        {
          "compensation_kind": "compensate_delete",
          "kind": "compensate",
          "values": {
            "entity": "claim_intake"
          }
        }
      ],
      "event": "compensate",
      "from_state": "review",
      "gates": [
        {
          "kind": "permission",
          "permission": "claim_intake.review"
        }
      ],
      "guards": [
        {
          "expr": {
            "var": "context.fraud_detected"
          },
          "kind": "expr"
        }
      ],
      "id": "claim_intake_fraud_detected_compensate",
      "priority": 7,
      "to_state": "compensated"
    }
  ],
  "version": "1.0.0"
}
